entityId,publishedAt,status,title,tags
3855941,2019-04-18T17:22:22-0300,True,Suspeito de assaltar supermercado em Florianópolis é baleado,"Florianópolis, Destaque Hora SC"
3855541,2019-04-18T16:55:48-0300,True,Caso Lucimara: OAB de Santa Catarina cria Comissão de Direito da Vítima,"feminicídio, Balneário Camboriú"
3855566,2019-04-18T16:51:42-0300,True,Volante Liel está de volta ao Criciúma ,"Criciúma, Criciúma EC, Série B, Esportes, Destaque DC"
3855416,2019-04-18T16:21:15-0300,True,Basquete feminino de Blumenau tenta quarta vitória seguida na liga nacional nesta quinta-feira,"Destaque Santa, Blumenau, basquete feminino"
3855001,2019-04-18T16:10:58-0300,True,Acompanhe a situação do trânsito nas rodovias de Santa Catarina,"BR-101, trânsito"
3855166,2019-04-18T16:09:40-0300,True,Secretaria Nacional de Pesca pede para suspender lista de peixes ameaçados de extinção,"meio ambiente, pesca, portaria 445"
3855061,2019-04-18T16:05:10-0300,True,Governo Moisés estima economizar até R$ 400 milhões com corte em repasses no duodécimo,"duodécimo, Lei de Diretrizes Orçamentárias, Santa Catarina, economia"
3855211,2019-04-18T15:58:49-0300,True,Confira a programação do 15º Rodeio do CTG Os Praianos em São José,"Rodeio, CTG, São José, tradicionalismo, Destaque Hora SC"
3855011,2019-04-18T15:36:36-0300,True,Bom Jesus não poderá demolir prédio que comprou do governo estadual na Rua XV de Novembro,"patrimônio histórico, Bom Jesus, prédio, feira de artesanato, Blumenau, educação"
3781326,2019-04-18T15:28:30-0300,True,"João Paulo, Tiepo e mais: Chico Lins analisa personagens da final do Catarinense 2019; vídeo","Esportes, Avaí, Chapecoense, Catarinense 2019, Destaque DC, Destaque Hora SC"
3854916,2019-04-18T15:15:47-0300,True,Veículo levado em assalto à residência em Blumenau nesta quinta-feira é encontrado ,"Destaque Santa, Polícia Militar, roubo de carro, assalto"
3854856,2019-04-18T15:10:53-0300,True,Quadros pintados por autistas são expostos na Câmara de Vereadores de Lages ,"Câmara de Vereadores, Lages, Autismo"
3854621,2019-04-18T15:07:36-0300,True,Um feriadão para aproveitar ao ar livre em Santa Catarina,"Páscoa, previsão do tempo, Santa Catarina"
3854561,2019-04-18T15:01:06-0300,True,Justiça condena professora de Fraiburgo acusada de bater em alunos a perder o emprego,"Fraiburgo, educação infantil"
3854626,2019-04-18T14:56:57-0300,True,O que abre e o que fecha no feriadão de Páscoa em Joinville,"agenda, Joinville, Páscoa"
3854411,2019-04-18T14:51:18-0300,True,JEC anuncia novos jogadores para a disputa da Série D,"JEC, Joinville, Destaque AN, Futebol"
3854076,2019-04-18T14:48:08-0300,True,"Kennedy Nunes: ""Eu não tenho vergonha de ser político""","Cabeça de Político, Kennedy Nunes"
3854176,2019-04-18T14:46:39-0300,True,"Polêmicas do VAR, Floripa Jazz e Paulo Bornhausen fora do PSB: uma conversa Fora do Tom","Árbitro de Vídeo, jazz, PSB, paulo bornhausen"
3853786,2019-04-18T14:34:34-0300,True,Justiça mantém condenação de homem de Rio do Sul que xingou nordestinos em rede social   ,"Destaque Santa, Rio do Sul"
3853951,2019-04-18T14:33:41-0300,True,Saiba onde almoçar e jantar no feriado de Páscoa em Joinville e região,"gastronomia, agenda cultural, Páscoa, Joinville"
3853731,2019-04-18T14:09:11-0300,True,Segunda etapa da campanha de vacinação contra a gripe começa nesta segunda-feira em Joinville,"saúde, vacinação, gripe, Joinville"
3853671,2019-04-18T14:05:21-0300,True,Rádio Jaraguá muda de dono,rádio
3853606,2019-04-18T14:02:44-0300,True,Polícia cumpre 17 mandados de prisão em operação realizada em São Bento do Sul,"Joinville, São Bento do Sul, polícia, operação"
3853481,2019-04-18T13:54:13-0300,True,Morre ciclista atropelado por caminhão em Garuva,"Joinville, Destaque AN, garuva, trânsito"
3852771,2019-04-18T13:33:30-0300,True,Hotéis de Balneário Camboriú e Floripa terão lotação de quase 90% no feriadão ,"Balneário Camboriú, Florianópolis, feriadão, feriado de pascoa"
3852401,2019-04-18T13:18:26-0300,True,O que abre e fecha no feriado de Páscoa em Blumenau ,"abre e fecha, Páscoa, feriado, Destaque Santa, Blumenau, comércio"
3851946,2019-04-18T13:07:36-0300,True,Justiça absolve desembargador Gallo acusado de corrupção por advogado de SC,"justiça, corrupção, tjsc"
3849621,2019-04-18T12:35:14-0300,True,Vazamento deixa sete bairros da região Central sem água em Joinville ,"Joinville, Destaque AN, falta de água"
3848871,2019-04-18T12:23:19-0300,True,FG planeja lançar mais 500 apartamentos em Balneário Camboriú em 2019,"economia, Balneário Camboriú, construção civil"
3848861,2019-04-18T12:22:23-0300,True,Itajaí decreta emergência e inicia força-tarefa para conter avanço do mosquito da dengue,"dengue, Volnei Morastoni, Itajaí, decreto"
3848546,2019-04-18T12:01:31-0300,True,Morre catador de lixo baleado ao tentar ajudar família que foi alvo de 80 tiros do Exército,"Rio de Janeiro, exército, Destaque NSC"
3848306,2019-04-18T11:59:59-0300,True,"Sexta-feira Santa terá Rota de Lazer na Rua XV de Novembro, em Blumenau","Blumenau, Rota de Lazer, Rua XV de Novembro, Destaque Santa"
3839341,2019-04-18T11:52:42-0300,True,Defesa quer habeas corpus para invalidar flagrante contra senegalês preso em Florianópolis,"Florianópolis, guarda municipal, Destaque Hora SC"
3847451,2019-04-18T11:43:20-0300,True,Zerar a fila das creches é prioridade da Prefeitura de Florianópolis  ,"Estúdio NSC Branded Content, Prefeitura Municipal de Florianópolis"
3847436,2019-04-18T11:42:54-0300,True,Macaco domesticado é abandonado em unidade dos bombeiros de Joinville,"meio ambiente, Joinville, Polícia Militar Ambiental, Ibama"
3847446,2019-04-18T11:32:27-0300,True,Sujou,"polêmica, PSL, deputada estadual, Facebook"
3847441,2019-04-18T11:29:11-0300,True,"Criminosos fazem criança e pai reféns durante assalto no Passo Manso, em Blumenau","assalto, Passo Manso, Blumenau, Destaque Santa"
3847421,2019-04-18T11:20:53-0300,True,Blumenau sofre derrota no Paraná e dá adeus às chances de classificação na Liga Ouro,"basquete, Blumenau, liga ouro, Esportes"
3847426,2019-04-18T11:08:06-0300,True,Motorista é preso em flagrante após atropelar ciclista e fugir em Cocal do Sul,"Cocal do Sul, Criciúma, atropelamento, ciclista, sul do estado, Polícia Civil, Polícia Militar"
3847416,2019-04-18T10:55:11-0300,True,"Homem é morto com um tiro no bairro Ingleses, em Florianópolis","homicídio, Florianópolis, Destaque Hora SC"
3847411,2019-04-18T10:50:40-0300,True,Desassoreamento de ribeirão em Blumenau já retirou nove toneladas de lixo,"ribeirão, Itoupavazinha, Blumenau, Destaque Santa"
3847406,2019-04-18T10:43:35-0300,True,Biguaçu decreta ponto facultativo e não tem expediente nesta quinta-feira,"feriado, Páscoa, Biguaçu, Grande Florianópolis, ponto facultativo"
3847401,2019-04-18T10:42:35-0300,True,Morre ex-secretário e juiz Walter Zigelli,luto
3847396,2019-04-18T10:35:07-0300,True,Comerciantes acreditam em fortalecimento do bairro com criação de rota gastronômica do Espinheiros,"Espinheiros, turismo, Joinville, Destaque AN"
3763451,2019-04-18T10:35:02-0300,True,"Artilheiro da Chape diz que rock antes dos jogos o ""deixa ligado""","Chapecoense, Campeonato Catarinense, Esportes"
3847391,2019-04-18T10:32:58-0300,True,Dois suspeitos de assaltar e agredir mulher morrem em confronto com a PM em São José,"polícia, São José, Destaque Hora SC"
3844966,2019-04-18T10:25:02-0300,True,Falando de Sexo: Existe frequência considerada “normal”?,Falando de Sexo
3847351,2019-04-18T10:21:26-0300,True,"Liberdade de expressão não pode servir para a alimentação do ódio, diz Toffoli","Dias Toffoli, Destaque NSC"
3847241,2019-04-18T10:16:06-0300,True,Por que devemos incentivar meninas e mulheres na tecnologia? ,tecnologia
3847316,2019-04-18T10:13:59-0300,True,Transformação do Espinheiros em espaço turístico deve começar no segundo semestre,"Espinheiros, turismo, Joinville, Destaque AN"
3847301,2019-04-18T10:12:43-0300,True,Mais uma vítima é encontrada em Muzema e número de mortos sobe para 20,"Rio de Janeiro, Desabamento no Rio, Destaque NSC"
3845621,2019-04-18T10:05:02-0300,True,Movimento encena a Paixão de Cristo nas escadarias da Catedral Metropolitana,"paixão de cristo, teatro, Catedral Metropolitana"
3847246,2019-04-18T09:53:56-0300,True,"Jovem de 21 anos morre ao bater contra poste na marginal da BR-101, em Camboriú ","trânsito, Camboriú, BR-101, acidente, Destaque Santa"
3847221,2019-04-18T09:43:15-0300,True,Dupla de Brusque lança álbum inspirado no Vale do Itajaí,"música, Brusque, lançamento, álbum, CD"
3847236,2019-04-18T09:42:33-0300,True,URB tem prazo de três anos até ser completamente extinta,"urb, Blumenau, cidade"
3846481,2019-04-18T09:40:01-0300,True,"Vaga em aberto no meio-campo do Avaí
","Avaí, Esportes"
3847231,2019-04-18T09:39:28-0300,True,Família que perdeu tudo em incêndio precisa de doações de roupas e material de construção,"incêndio, Florianópolis, solidariedade, Saco dos Limões, fogo, chamas, Destaque Hora SC"
3847226,2019-04-18T09:31:58-0300,True,Horóscopo: confira a previsão de cada signo para esta quinta-feira 18/04 ,"horóscopo, astrologia"
3778521,2019-04-18T09:20:01-0300,True,Acessos em 2018 unem Geninho e Ney na decisão do Catarinense,"Destaque DC, Destaque Hora SC, Futebol, Esportes, Catarinense 2019, Chapecoense, Ney Franco, Geninho, Avaí, ressacada"
3847216,2019-04-18T08:51:29-0300,True,Suspeitos de decapitar e desmembrar jovem são presos em São Francisco do Sul ,"Joinville, Destaque AN, São Francisco do Sul, decapitação, segurança"
3847211,2019-04-18T08:44:37-0300,True,Acidente resulta em lentidão no trânsito da SC-401 na manhã desta quinta,"acidente, SC-401, trânsito"
3847206,2019-04-18T08:43:11-0300,True,Celesc responde,Celesc
3847201,2019-04-18T08:40:17-0300,True,"Há 20 anos, Emaús encena a Paixão de Cristo","paixão de cristo, Páscoa, tradição"
3845561,2019-04-18T08:35:01-0300,True,Festa do cinema infantil na Capital,"cinema, Mostra de Cinema Infantil de Florianópolis"
3847196,2019-04-18T08:32:43-0300,True,Encontros do Céu e da Terra,"tac, música, musical"
3846886,2019-04-18T08:13:33-0300,True,Projeto prevê Macuca e estação de trem na praça da prefeitura,"macuca, estação, Blumenau, concessão, iniciativa privada"
3846901,2019-04-18T08:03:20-0300,True,Obra interdita trecho de avenida e deixa nove bairros sem água em Joinville,"Destaque AN, falta de água, Joinville, obra"
3846396,2019-04-18T07:35:02-0300,True,Paixão Alvinegra: o Estadual não nos pertence mais,"Paixão Alvinegra, Figueirense, Esportes"
3846606,2019-04-18T07:34:32-0300,True,Temperatura pode chegar aos 31°C nesta quinta em Joinville,"Joinville, Destaque AN, calor, previsão do tempo"
3846251,2019-04-18T07:30:02-0300,True,Paixão Azurra: no sábado também terá torcida na Ressacada,"Paixão Azurra, Avaí, Esportes"
3846601,2019-04-18T07:13:16-0300,True,"""Naninhas"" para animar a páscoa das crianças",comunidade
3846596,2019-04-18T07:06:57-0300,True,Rua General Osório terá trânsito parcialmente interrompido nesta quinta-feira para obras  ,"rua general osório, Blumenau, trânsito, obras, Destaque Santa"
3845516,2019-04-18T07:05:01-0300,True,CIEE lança serviço para jovens da comunidade,"emprego, mercado de trabalho"
3772541,2019-04-18T07:00:02-0300,True,Gabriel Elias em Joinville,música
3846561,2019-04-18T06:55:02-0300,True,Técnico da Chapecoense diz que time estará recuperado até a final ,"Chapecoense, Corinthians-SP, copa do brasil, Campeonato Catarinense, Avaí, Esportes"
3846511,2019-04-18T06:45:01-0300,True,"Figueirense dever ter um atacante velocista
","Figueirense, Esportes"
3767496,2019-04-18T06:10:01-0300,True,"Depois do amanhecer frio, tarde desta quinta-feira terá temperaturas elevadas em SC","sexta-feira santa, previsão do tempo, Santa Catarina, Outono"
3839206,2019-04-18T06:00:02-0300,True,Ação que pode causar rombo no caixa do governo está pronta para ser julgada no STF,"STF, governo estadual, Alesc"
3845421,2019-04-18T05:55:01-0300,True,Marceneira de Palhoça está na final de concurso nacional de empreendedorismo feminino,"empreendedorismo, construção civil, Destaque Hora SC"
3828216,2019-04-18T05:50:01-0300,True,Começam trabalhos de reformas das pontes Colombo Salles e Pedro Ivo Campos,"Ponte Pedro Ivo Campos, Ponte Colombo Salles, Ponte Hercílio Luz"
3844611,2019-04-18T05:50:01-0300,True,Câmara de Joinville arquiva projeto sobre posse temporária de vereadores ,"Câmara de Joinville, projeto, arquivamento"
3839591,2019-04-18T05:50:00-0300,True,"Atividade econômica cresce 2,58% em SC","atividade econômica, ibcr-sc"
3839671,2019-04-18T05:35:01-0300,True,"“Às 5h da manhã de 1º de outubro vamos operar no novo terminal”, diz CEO da Floripa Airport","floripa airport, Aeroporto Hercílio Luz"
3827461,2019-04-18T05:30:01-0300,True,Nova manifestação artística no Centro de Florianópolis,"arte urbana, obra de arte, grafite"
3838871,2019-04-18T05:20:01-0300,True,Senador Esperidião Amin é condecorado em Brasília ,"Esperidião Amin, brasília"
3826091,2019-04-18T05:00:02-0300,True,Acesso ao Sul da Ilha: a diferença entre 1º e 30 de outubro,"aeroporto, floripa airport"
3839601,2019-04-18T05:00:02-0300,True,Sinal de alerta no Planalto ,"Jair Bolsonaro, reforma da previdência"
3842776,2019-04-18T05:00:02-0300,True,Zeca Baleiro subirá ao palco com a Camerata Florianópolis neste mês,"zeca baleiro, camerata florianópolis, show"
3845131,2019-04-18T04:50:02-0300,True,Índice de Atividade Econômica aponta maior queda desde a greve dos caminhoneiros,"bradesco, crescimento, índice de atividade econômica"
3841991,2019-04-18T04:30:02-0300,True,Hospital de Caridade ficará sem atendimento pelo SUS se perder o certificado de filantropia,"Hospital de Caridade, SUS, filantropia"
3843986,2019-04-18T04:20:01-0300,True,Pelo menos 25% de pacientes com câncer terão de esperar mais de 60 dias para tratamento em Joinville,"Joinville, tratamento contra câncer"
3837026,2019-04-18T04:00:02-0300,True,Zurich: Falta o produto turístico,"floripa airport, Aeroporto Hercílio Luz"
3841761,2019-04-18T04:00:02-0300,True,"FOTOS: veja as imagens da coluna do Cacau desta quinta-feira, 18 de abril",fotos
3845156,2019-04-18T03:00:01-0300,True,"31ª Festilha, em São Francisco do Sul, gerou 400 empregos em quatro dias","empregos temporários, Festilha, São Francisco do Sul"
3845581,2019-04-17T23:56:46-0300,True,Chapecoense comemora vantagem e já pensa no Avaí ,"Esportes, Chapecoense, corinthians, copa do brasil, Avaí, Campeonato Catarinense"
3844656,2019-04-17T23:24:13-0300,True,Aylon marca e Chapecoense vence o Corinthians pela Copa do Brasil,"Chapecoense, Esportes, copa do brasil, corinthians"
3840966,2019-04-17T22:15:58-0300,True,Bosque Carlos Gerd Schroeder será inaugurado nesta quinta-feira em Rio do Sul ,"Destaque Santa, Rio do Sul"
3840141,2019-04-17T21:53:46-0300,True,Jovem é morto por disparo de arma de fogo no Centro de Blumenau ,"homicídio, Blumenau, Centro, Destaque Santa"
3840101,2019-04-17T21:52:02-0300,True,Chapecoense x Corinthians: acompanhe o jogo pela Copa do Brasil,"Esportes, Chapecoense, copa do brasil"
3838241,2019-04-17T21:38:36-0300,True,Deputado estadual Bruno Souza cancela filiação no PSB,PSB
3839351,2019-04-17T21:33:58-0300,True,"Empresária morre em acidente em Itapiranga, no Oeste de SC","sc-163, Itapiranga"
3829111,2019-04-17T21:13:46-0300,True,"Com atraso da reforma da Previdência na CCJ, dólar vai a R$ 3,935 ","reforma da previdência, Dólar, economia"
3837326,2019-04-17T21:08:27-0300,True,"Audiência com ministro para tratar de retomada de obras na BR-282, na região Oeste ","BR-282, BR-158, Chapecó, São Miguel do Oeste, Dnit"
3831911,2019-04-17T20:29:17-0300,True,Ciclista é atropelado por caminhão na SC-417 em Garuva,"Joinville, Destaque AN, garuva, acidente, atropelamento"
3822896,2019-04-17T19:54:31-0300,True,Governo autoriza uso da Força Nacional para segurança na Esplanada ,"brasília, Esplanada dos Ministérios, STF"
3817756,2019-04-17T19:43:08-0300,True,Daniel Costa usa exemplo do CSA e vê Criciúma na luta pelo acesso,"Destaque DC, Série B, Criciúma EC, Esportes, Criciúma"
3821166,2019-04-17T19:38:41-0300,True,"Petrobras anuncia aumento de R$ 0,10 no diesel ","combustíveis, diesel, petrobras, Destaque Hora SC"
3776141,2019-04-17T19:30:02-0300,True,Chapecoense ultrapassa Criciúma e Figueirense e disputa a quarta final seguida de Catarinense,"Esportes, Catarinense 2019, Chapecoense, Avaí, Destaque DC"
3815736,2019-04-17T19:22:39-0300,True,Moisés compra a briga pela redução dos repasses aos poderes,"Carlos Moisés da Silva, duodécimo"
3817516,2019-04-17T19:22:36-0300,True,Jovem de Corupá cogitado como possível vítima de Brumadinho é localizado ,"Joinville, Destaque AN, desaparecido, Brumadinho, Corupá"
3811271,2019-04-17T19:19:06-0300,True,Veja o que abre e o que fecha em Florianópolis no feriado da Sexta-Feira da Paixão,"comércio, Páscoa, Destaque Hora SC"
3808026,2019-04-17T19:17:49-0300,True,Fellipe Mateus almeja briga pelo acesso ao chegar no Figueirense,"Destaque DC, Destaque Hora SC, Futebol, Série B, Figueirense, Esportes"
3815396,2019-04-17T19:14:46-0300,True,Feriado de Páscoa terá atrações em diversas regiões do Estado,Destaque NSC
3815341,2019-04-17T19:14:41-0300,True,Assaltantes morrem em troca de tiros com a PM após roubarem loja em Navegantes ,"Destaque Santa, Polícia Militar, assalto"
3811531,2019-04-17T18:59:47-0300,True,Prefeitura de Brusque autoriza início da obra da Margem Esquerda da Beira-Rio ,"Brusque, margem esquerda, Beira-Rio, mobilidade"
3807391,2019-04-17T18:55:22-0300,True,Críticas em SC contra ministros Toffoli e Moraes sobre inquérito,"Dias Toffoli, alexandre moraes, inquérito"
3808051,2019-04-17T18:47:35-0300,True,"Combate à corrupção será prioridade, diz novo procurador-geral de Justiça de SC","Destaque NSC, mpsc, Destaque DC, Destaque AN, Destaque Santa, justiça"
3807386,2019-04-17T18:35:45-0300,True,Caminhão da Caixa renegocia dívidas até esta quinta-feira em Blumenau,"Blumenau, Caixa Econômica Federal, renegociação de dívida, finanças pessoais"
3806831,2019-04-17T18:28:19-0300,True,João Paulo prioriza título com o Avaí em vez de craque do Catarinense 2019,"Esportes, Avaí, Catarinense 2019, Destaque DC, Destaque Hora SC"
3806301,2019-04-17T18:26:19-0300,True,"Piscicultor doa uma tonelada de peixe para famílias carentes em Orleans, Sul de SC","doação, semana santa, Páscoa, sexta-feira santa, Orleans, sul de sc, peixe de água doce"
3798836,2019-04-17T18:02:50-0300,True,Vice-líder do governo na Câmara pede impeachment do general Mourão e cita Dilma,"impeachment, Hamilton Mourão, Marco Feliciano"
3792506,2019-04-17T18:00:25-0300,True,Homem agride agente da Guarda Municipal de Trânsito em Blumenau após fugir de abordagem ,"Destaque Santa, Blumenau, guarda municipal de trânsito"
3790121,2019-04-17T17:35:13-0300,True,Proibição de canudos plásticos em SC repercute entre empresários e ambientalistas,"meio ambiente, preservação ambiental, canudinho, Alesc, Destaque Hora SC"
3786971,2019-04-17T17:25:35-0300,True,"Programação no Morro da Cruz, em Lages, deve reunir cerca de 80 mil fiéis","sexta-feira santa, morro da cruz, Lages, Páscoa, programação"
3788321,2019-04-17T17:23:02-0300,True,Thalita Rebouças é presença confirmada na Feira do Livro de Joinville,"cultura, Joinville, Destaque AN"
3781346,2019-04-17T17:02:14-0300,True,"Com apoio incerto no Governo do Estado, Itajaí pode perder a Volvo Ocean Race","volvo ocean race, Itajaí, governo do estado"
3781341,2019-04-17T16:46:42-0300,True,Orgulho catarinense: produtos de qualidade,Potencial Econômico Icasa
3781331,2019-04-17T16:26:25-0300,True,Prefeitura de Joinville realiza obras de drenagem e de prevenção a alagamentos,"infraestrutura, enchentes, Joinville, Destaque AN"
3781321,2019-04-17T16:16:31-0300,True,Saiba como temperar cada corte de carne suína,Alimentação Saudável Icasa
3774296,2019-04-17T15:34:14-0300,True,Jantando com o governador,"Cacau Menezes, Carlos Moisés da Silva"
3774496,2019-04-17T15:21:21-0300,True,Três homens são condenados a mais de 50 anos pela morte de empresário de São José,"polícia, julgamento, homicídio, Destaque Hora SC"
3771051,2019-04-17T14:55:41-0300,True,Balneário Camboriú é a primeira cidade na América Latina a receber conferência sobre cristais líquidos,"conferência, cristal, Balneário Camboriú"
3770986,2019-04-17T14:50:45-0300,True,Vídeo: vereadores jogam mamadeira um contra o outro na Câmara de Campos Novos ,"Câmara de Vereadores, Campos Novos, política, vereadores"
3770961,2019-04-17T14:46:37-0300,True,Corregedor-geral da UFSC volta às atividades após conseguir liminar na Justiça,UFSC
3770216,2019-04-17T14:37:05-0300,True,Feriadão da Páscoa movimenta aeroportos,"feriadão, Páscoa, aeroportos, movimento"
3766111,2019-04-17T14:20:20-0300,True,Santa Catarina terá uma quinta-feira com amanhecer frio e tarde quente,"previsão do tempo, Santa Catarina, Outono"
3764546,2019-04-17T14:20:01-0300,True,Quiz: o quanto você sabe sobre o Catarinense 2019?,"Quiz, catarinense, Campeonato Catarinense, Catarinense 2019, Futebol"
3765996,2019-04-17T14:13:48-0300,True,Bolsonaro diz que Exército 'respira e transpira democracia e liberdade',"exército, Jair Bolsonaro"
3765546,2019-04-17T14:10:38-0300,True,Polícia indicia homem por tentar matar a ex-mulher enquanto ela ia trabalhar em Joinville ,"Joinville, Destaque AN, prisão, violência contra mulher"
3764781,2019-04-17T13:58:01-0300,True,Entenda a polêmica envolvendo a reportagem sobre o ministro Dias Toffoli e a censura do STF,"STF, censura, Polícia Federal, Destaque DC, Destaque NSC"
3764771,2019-04-17T13:54:04-0300,True,Instabilidade em máquina leva Hospital Regional de Joinville a suspender parte das cirurgias cardíacas,"saúde, cirurgia cardíaca, urgência, emergência, Hospital Regional Hans Dieter Schmidt, Joinville"
3764701,2019-04-17T13:45:57-0300,True,Ex-presidente do Peru morre em hospital após dar tiro na cabeça,"Peru, odebrecht, suicídio, Destaque NSC"
3764676,2019-04-17T13:34:08-0300,True,Milionário no Sul de Santa Catarina ,"Criciúma, Lotomania, milionário, sul do estado"
3764611,2019-04-17T13:13:34-0300,True,Lucas Spernau vai a julgamento no dia 6 de junho em Balneário Camboriú,"acidente de trânsito, mortes, julgamento, Balneário Camboriú"
3764591,2019-04-17T12:42:08-0300,True,"Princípio de incêndio é registrado no Centreventos Cau Hansen, em Joinville","incêndio, Joinville, cultura"
3764576,2019-04-17T12:09:06-0300,True,Revista Time coloca presidente Bolsonaro entre as 100 pessoas mais influentes do mundo,"Jair Bolsonaro, influências, Bolsonaro"
3764501,2019-04-17T12:08:14-0300,True,Promotoria recebe novo vídeo do motorista do Jaguar minutos antes do acidente,"Destaque Santa, Gaspar, BR-470, jaguar, acidente"
3764566,2019-04-17T12:04:48-0300,True,Camilo Martins rejeita tese que permitiria terceiro mandato em Palhoça,"camilo martins, palhoça"
3764571,2019-04-17T12:02:08-0300,True,Rodovias de Santa Catarina recebem reforço na fiscalização durante feriadão de Páscoa,"Páscoa, feriadão, trânsito"
3764561,2019-04-17T11:48:32-0300,True,MP investiga se Ana Campagnolo usou diárias da Alesc para promover livro antifeminista,"mpsc, investigação, diárias"
3764551,2019-04-17T11:38:37-0300,True,"Para ajudar a disseminar o inglês, mercado de Blumenau adota comunicação bilíngue","Blumenau, economia, inglês"
3764556,2019-04-17T11:34:40-0300,True,"TJ determina retirada de 139 animais da residência de casal em Schroeder, no Norte de SC","Joinville, Destaque AN, decisão, Schroeder"
3764541,2019-04-17T11:02:04-0300,True,"Damares Alves diz que, na concepção cristã, a mulher é ""submissa ao homem no casamento""","câmara dos deputados, Damares Alves"
3764536,2019-04-17T11:01:01-0300,True,Itapoá registra primeiro caso de dengue deste ano,"Joinville, itapoá, dengue, Destaque AN"
3764531,2019-04-17T10:57:38-0300,True,Reforma da Previdência: CCJ marca votação de parecer para esta quarta-feira,"reforma da previdência, câmara dos deputados, aposentadoria, Destaque NSC"
3764511,2019-04-17T10:49:41-0300,True,O que se sabe sobre o incêndio da Notre-Dame de Paris ,"França, incêndio"
3764521,2019-04-17T10:34:15-0300,True,"PIB do Vale cresce acima da média de SC em 2018, calcula Facisc","economia, PIB, Facisc, Vale do Itajaí"
3764526,2019-04-17T10:33:52-0300,True,Bolsonaro é incluído na lista das 100 pessoas mais influentes do mundo da Revista Time,"Jair Bolsonaro, Estados Unidos, Destaque NSC"
3764376,2019-04-17T10:20:02-0300,True,Você acha que é alérgico à camisinha? ,Falando de Sexo
3763226,2019-04-17T10:20:02-0300,True,"Avaí conta com três goleiros, enquanto Chape tem um para a final","Esportes, Catarinense 2019, Avaí, Chapecoense, Destaque DC, Destaque Hora SC"
3764496,2019-04-17T10:10:37-0300,True,"Novo Frohsinn vai ficar para 2020, na melhor das hipóteses","Frohsinn, turismo, Blumenau, eventos, restaurante"
3764516,2019-04-17T10:06:27-0300,True,"Setor de TI avança nas exportações em SC, mas é preciso estímulo tributário",tecnologia
3764506,2019-04-17T09:53:31-0300,True,Estácio amplia atendimento para auxiliar na declaração do imposto de renda,"imposto de renda, declaração do imposto de renda, Florianópolis, São José, Grande Florianópolis, estádio, Papo da Hora"
3764421,2019-04-17T09:35:02-0300,True,Cavalaria da PM tem projeto de equoterapia em São José,"equoterapia, saúde"
3764491,2019-04-17T09:29:17-0300,True,Vão encontrar o que?,"CPI, ponte, floripa"
